<?xml version="1.0" encoding="UTF-8"?>
        <!--
          ~ /*
          ~  * cdoj, UESTC ACMICPC Online Judge
          ~  * Copyright (c) 2013 fish <@link lyhypacm@gmail.com>,
          ~  * 	mzry1992 <@link muziriyun@gmail.com>
          ~  *
          ~  * This program is free software; you can redistribute it and/or
          ~  * modify it under the terms of the GNU General Public License
          ~  * as published by the Free Software Foundation; either version 2
          ~  * of the License, or (at your option) any later version.
          ~  *
          ~  * This program is distributed in the hope that it will be useful,
          ~  * but WITHOUT ANY WARRANTY; without even the implied warranty of
          ~  * MERCHANTABILITY or FITNESS FOR A PARTICULAR PURPOSE.  See the
          ~  * GNU General Public License for more details.
          ~  *
          ~  * You should have received a copy of the GNU General Public License
          ~  * along with this program; if not, write to the Free Software
          ~  * Foundation, Inc., 51 Franklin Street, Fifth Floor, Boston, MA  02110-1301, USA.
          ~  */
          -->

        <!-- START SNIPPET: settingsDtd -->

        <!--
           UESTC Online Judge Settings configuration DTD.
           Use the following DOCTYPE

           <!DOCTYPE cdoj-settings SYSTEM "cdoj-settings.dtd">
        -->
        <!ELEMENT cdoj-settings (setting)*>
        <!ELEMENT setting (item|list)*>
        <!ATTLIST setting
                name CDATA #REQUIRED
                >

        <!ELEMENT list (item)*>
        <!ATTLIST list
                name CDATA #REQUIRED
                description CDATA #REQUIRED
                >

        <!ELEMENT item (#PCDATA|prop)*>
        <!ATTLIST item
                name CDATA #REQUIRED
                description CDATA #REQUIRED
                >
        <!ELEMENT prop (#PCDATA)>
        <!ATTLIST prop
                name CDATA #REQUIRED
                value CDATA #REQUIRED
                >

